[{"adr_refs":["docs/adr/adr-001-transport-protocol.md"],"artifact_ids":["artifact:5f126e3f65e9973b75f256931c8f56ef5c10fce96dc6be43eee0442b7d3eaf71","artifact:af3d308e231a7968eea3d46457851b19a65324e505028f3f905659b54e859ecc","artifact:d975b17685aec233a012ffd6a4d9f59013dd15d5e8723a70446ee95a40822a5a","artifact:f7ede513d2b6b1728a049f3d5dfb16b8194a6c17f3fb71081af46f418542a4c0","artifact:fe5b06075d3778c6952dc2966f2d90c521e9866bdec32b075d42c4efaca36838"],"capability_ids":["capability:l9-gate-sdk:library","capability:l9-gate-sdk:topology"],"confidence":{"authority":"validated-machine","completeness":"sufficient","conflict_status":"none","derivation_method":"deterministic","evidence_strength":"corroborated","level":"high"},"downstream_repository_ids":["repo:l9-mcp-server"],"entrypoints":[],"evidence_refs":["evidence:08ca8f0cd96a01443445b6387276901fbaf327dffc2300a6db16a341bf1959ef","evidence:2b5e0a5f4722f1f0912ed76f4154d926770011124bcbddbc892f04c67c9d4b15","evidence:557d52b82c0b9cf39a92ad68dc6f894ce490cfced8974cea75adcd3eea642d8e","evidence:77ea38aad92ee15e35e79e63a72d6bf1578f61a214f76d96efe25ccbcbd4412c","evidence:9745cf9f5aa2a55d0d0ec956f595a9102051224f6da654c5e756128b06ba6c50","evidence:ad85781ad2fab7fd28d63dd6e14ddbc6fa1d3b54ce1978223c93bc704ae485e5","evidence:d2338cd112c2b2367b1e129321fa71b7ea910795b0328749b40ebc0e454cd0e6"],"governance_refs":[".github/CODEOWNERS"],"languages":["Python"],"name":"l9-gate-sdk","owner_ids":["owner:igor_beylin"],"package_managers":["uv/pip"],"packet_ref":"urn:l9:legacy-scan:l9-gate-sdk:sha256:2f1b01a06ce09c949f818027a0253710d380f477824e09127a848d862d3943d7","primary_role":"library","repository_id":"repo:l9-gate-sdk","secondary_roles":["topology"],"source_revision":"tree:2f1b01a06ce09c949f818027a0253710d380f477824e09127a848d862d3943d7","unresolved_dependencies":["httpx","pydantic"],"upstream_repository_ids":[],"workflows":[".github/workflows/ci.yml"]},{"adr_refs":[],"artifact_ids":["artifact:2dce6ccb144fcee4e7086e61cf238dbc76585c50ea2bc647a75724c85385eede","artifact:9c1767f9bb12ecc3e5fb0fe32b10a967ecadd3960c4ebb25e402edab71fbe95e","artifact:c1f3dea4a6f3b19b6e14b37ffaeceeb7eb450c94a643a239b5cb11605e3c0a1d"],"capability_ids":["capability:l9-mcp-server:service","capability:l9-mcp-server:topology"],"confidence":{"authority":"validated-machine","completeness":"sufficient","conflict_status":"none","derivation_method":"deterministic","evidence_strength":"corroborated","level":"high"},"downstream_repository_ids":[],"entrypoints":[],"evidence_refs":["evidence:053ade54eab180cfb6442885f9b719e70855791f3ca2005aaf8172f26077af5a","evidence:69a738878ad517887bb645a85d8020726f36ac3d8c9b988befd492ab82c9f402","evidence:8f4331cf9239c6121cb63ea3568998cdf31f0cf1cc1beef54201ac03d6ebd525","evidence:944d594375fc539e595d57462092de4c3af2837ec28ab2be4712373efd08be46","evidence:c87556ab9f0ac784f89a55b400f8a6c61be905b44e23f5d40e47aaa6c4a376a5","evidence:d538fed45f2e9814b7540a1928f642f4a07c1f6babca0d515e02a58b027be91a"],"governance_refs":[],"languages":["Python"],"name":"l9-mcp-server","owner_ids":[],"package_managers":["uv/pip"],"packet_ref":"urn:l9:legacy-scan:l9-mcp-server:sha256:b0d3d89f622da21653c9df9f7fad9cdd880b1ada444fbc5dbbcf6ad349d78180","primary_role":"service","repository_id":"repo:l9-mcp-server","secondary_roles":["topology"],"source_revision":"tree:b0d3d89f622da21653c9df9f7fad9cdd880b1ada444fbc5dbbcf6ad349d78180","unresolved_dependencies":["fastapi","uvicorn"],"upstream_repository_ids":["repo:l9-gate-sdk"],"workflows":[".github/workflows/deploy.yml"]}]
